{
  "name": "步步登高",
  "recordSteps": 600,
  "floorRows": 3,
  "theme": {
    "void": "#0A0718",
    "upper": "#1A0F2C",
    "lower": "#261736"
  },
  "ground": [
    {
      "col": 1,
      "w": 3
    },
    {
      "col": 4,
      "w": 3
    },
    {
      "col": 7,
      "w": 3
    },
    {
      "col": 10,
      "w": 3
    },
    {
      "col": 13,
      "w": 3
    },
    {
      "col": 16,
      "w": 3
    },
    {
      "col": 19,
      "w": 3
    },
    {
      "col": 22,
      "w": 3
    },
    {
      "col": 25,
      "w": 3
    },
    {
      "col": 28,
      "w": 3
    },
    {
      "col": 31,
      "w": 3
    },
    {
      "col": 34,
      "w": 3
    },
    {
      "col": 37,
      "w": 3
    },
    {
      "col": 40,
      "w": 3
    },
    {
      "col": 43,
      "w": 3
    },
    {
      "col": 46,
      "w": 3
    }
  ],
  "tier2Tiles": [
    {
      "col": 16,
      "w": 3
    },
    {
      "col": 19,
      "w": 3
    },
    {
      "col": 22,
      "w": 3
    },
    {
      "col": 25,
      "w": 3
    }
  ],
  "ledges": [
    {
      "col0": 25,
      "col1": 27,
      "row": 12.5
    },
    {
      "col0": 28,
      "col1": 30,
      "row": 12.5
    },
    {
      "col0": 34,
      "col1": 36,
      "row": 17.5
    },
    {
      "col0": 37,
      "col1": 39,
      "row": 17.5
    },
    {
      "col0": 31,
      "col1": 33,
      "row": 12.5
    }
  ],
  "rigs": [
    {
      "plate": {
        "col": 3,
        "w": 2,
        "tier": 1
      },
      "lift": {
        "col": 13,
        "w": 3,
        "restTier": 1,
        "topTier": 2
      },
      "color": "#46E5F2"
    },
    {
      "plate": {
        "col": 31.5,
        "w": 2,
        "tier": 1
      },
      "lift": {
        "col": 20.5,
        "w": 3,
        "restTier": 2,
        "topTier": 3
      },
      "color": "#FFB23E"
    }
  ],
  "walls": [
    {
      "tier": 3,
      "col": 29.5,
      "w": 3,
      "h": 3
    }
  ],
  "stones": [
    {
      "tier": 3,
      "col": 27.5,
      "w": 2
    }
  ],
  "spikes": [
    {
      "tier": 1,
      "col": 25.5,
      "w": 2
    }
  ],
  "key": {
    "col": 28,
    "tier": 3,
    "w": 1,
    "h": 2,
    "dy": 2
  },
  "door": {
    "col": 36,
    "tier": 5,
    "w": 2,
    "h": 3,
    "glow": [
      "#C265FF",
      22
    ]
  },
  "clones": 2,
  "spawn": {
    "col": 10,
    "tier": 1
  }
}
