{
  "name": "推箱",
  "recordSteps": 600,
  "floorRows": 3,
  "theme": {
    "void": "#060A1A",
    "upper": "#0D1434",
    "lower": "#161E40"
  },
  "ground": [
    {
      "col": 1,
      "w": 3
    },
    {
      "col": 4,
      "w": 3
    },
    {
      "col": 7,
      "w": 3
    },
    {
      "col": 16,
      "w": 3
    },
    {
      "col": 19,
      "w": 3
    },
    {
      "col": 22,
      "w": 3
    },
    {
      "col": 25,
      "w": 3
    },
    {
      "col": 28,
      "w": 3
    },
    {
      "col": 31,
      "w": 3
    },
    {
      "col": 34,
      "w": 3
    },
    {
      "col": 37,
      "w": 3
    },
    {
      "col": 40,
      "w": 3
    },
    {
      "col": 43,
      "w": 3
    },
    {
      "col": 46,
      "w": 3
    },
    {
      "col": 10,
      "w": 3
    }
  ],
  "tier2Tiles": [
    {
      "col": 40,
      "w": 3
    },
    {
      "col": 31
    },
    {
      "col": 34
    },
    {
      "col": 37
    }
  ],
  "rigs": [
    {
      "plate": {
        "col": 7.5,
        "w": 2,
        "tier": 1
      },
      "lift": {
        "col": 28,
        "w": 3,
        "restTier": 1,
        "topTier": 2
      },
      "color": "#46E5F2"
    }
  ],
  "boxes": [
    {
      "tier": 1,
      "col": 16.5
    },
    {
      "tier": 1,
      "col": 16.5,
      "dy": 2
    },
    {
      "tier": 1,
      "col": 7.5
    }
  ],
  "pits": [
    {
      "tier": 1,
      "col0": 10,
      "col1": 12
    }
  ],
  "key": {
    "col": 35,
    "tier": 2,
    "w": 1,
    "h": 2
  },
  "door": {
    "col": 38,
    "tier": 2,
    "w": 2,
    "h": 3,
    "glow": [
      "#C265FF",
      22
    ]
  },
  "clones": 1,
  "spawn": {
    "col": 22.5,
    "tier": 1
  }
}
