{
  "name": "推箱子",
  "recordSteps": 600,
  "floorRows": 3,
  "theme": {
    "void": "#08071A",
    "upper": "#160F30",
    "lower": "#221638"
  },
  "rigs": [],
  "key": {
    "col": 30,
    "tier": 3,
    "w": 1,
    "h": 2
  },
  "door": {
    "col": 41.5,
    "tier": 3,
    "w": 2,
    "h": 3,
    "glow": [
      "#C265FF",
      22
    ]
  },
  "clones": 1,
  "spawn": {
    "col": 4.5,
    "tier": 1
  },
  "boxes": [
    {
      "col": 10.5,
      "tier": 1
    },
    {
      "col": 16.5,
      "tier": 1
    },
    {
      "col": 16.5,
      "tier": 1,
      "dy": 2
    },
    {
      "col": 22.5,
      "tier": 1
    },
    {
      "col": 22.5,
      "tier": 1,
      "dy": 2
    },
    {
      "col": 22.5,
      "tier": 1,
      "dy": 4
    }
  ],
  "ledges": [
    {
      "col0": 27.5,
      "col1": 29.5,
      "row": 7.5
    },
    {
      "col0": 30.5,
      "col1": 32.5,
      "row": 7.5
    },
    {
      "col0": 33.5,
      "col1": 35.5,
      "row": 7.5
    },
    {
      "col0": 36.5,
      "col1": 38.5,
      "row": 7.5
    },
    {
      "col0": 39.5,
      "col1": 41.5,
      "row": 7.5
    },
    {
      "col0": 42.5,
      "col1": 44.5,
      "row": 7.5
    }
  ],
  "walls": [],
  "spikes": [
    {
      "col": 35.5,
      "w": 2,
      "tier": 3
    }
  ]
}
