{
  "name": "穿越时空的钥匙",
  "recordSteps": 600,
  "floorRows": 3,
  "theme": {
    "void": "#050A18",
    "upper": "#0C1630",
    "lower": "#14223C"
  },
  "ground": [
    {
      "col": 1,
      "w": 3
    },
    {
      "col": 4,
      "w": 3
    },
    {
      "col": 7,
      "w": 3
    },
    {
      "col": 13,
      "w": 3
    },
    {
      "col": 16,
      "w": 3
    },
    {
      "col": 19,
      "w": 3
    },
    {
      "col": 22,
      "w": 3
    },
    {
      "col": 25,
      "w": 3
    },
    {
      "col": 28,
      "w": 3
    },
    {
      "col": 31,
      "w": 3
    },
    {
      "col": 34,
      "w": 3
    },
    {
      "col": 37,
      "w": 3
    },
    {
      "col": 40,
      "w": 3
    },
    {
      "col": 43,
      "w": 3
    },
    {
      "col": 46,
      "w": 3
    }
  ],
  "tier2Tiles": [
    {
      "col": 4
    },
    {
      "col": 7
    },
    {
      "col": 16
    },
    {
      "col": 13,
      "w": 3
    }
  ],
  "ledges": [],
  "rigs": [
    {
      "plate": {
        "col": 44,
        "w": 2,
        "tier": 1
      },
      "lift": {
        "col": 19,
        "w": 3,
        "restTier": 1,
        "topTier": 2
      },
      "color": "#46E5F2"
    }
  ],
  "bomb": {
    "col": 17,
    "tier": 2
  },
  "walls": [
    {
      "tier": 1,
      "col": 33,
      "w": 3,
      "h": 3
    }
  ],
  "boxes": [
    {
      "tier": 1,
      "col": 24.5
    }
  ],
  "stones": [
    {
      "tier": 1,
      "col": 39,
      "w": 2
    },
    {
      "tier": 1,
      "col": 39,
      "w": 2,
      "dy": 2
    }
  ],
  "spikes": [],
  "pits": [
    {
      "tier": 1,
      "col0": 10,
      "col1": 12
    },
    {
      "tier": 2,
      "col0": 10,
      "col1": 12
    }
  ],
  "key": {
    "col": 37,
    "tier": 1,
    "w": 1,
    "h": 2
  },
  "door": {
    "col": 6,
    "tier": 2,
    "w": 2,
    "h": 3,
    "glow": [
      "#C265FF",
      22
    ]
  },
  "clones": 1,
  "spawn": {
    "col": 28.5,
    "tier": 1
  }
}
